{
  "fixtureID": "uni0079",
  "height": 700,
  "invert": false,
  "options": {
    "emHeight": 1088.0,
    "grid": 2,
    "smoothing": 1.0
  },
  "rasterPNG_SHA256": "a3f8237488f2ad22d8fb3295caf6fede63b4e7dfe9a1914538fc5e5f80571e00",
  "schemaVersion": 1,
  "sourceRevision": "23073ca08ecdac61ad0e838bfae49a590bc2c7cc",
  "stage": "preparedRaster",
  "threshold": 127,
  "width": 364
}
