{
  "fixtureID": "uni0076",
  "height": 700,
  "invert": false,
  "options": {
    "emHeight": 1088.0,
    "grid": 2,
    "smoothing": 1.0
  },
  "rasterPNG_SHA256": "f040447abac30a6e592cf37dcbb84c27549f045117552e6d4a74fa6fb4f6ba58",
  "schemaVersion": 1,
  "sourceRevision": "23073ca08ecdac61ad0e838bfae49a590bc2c7cc",
  "stage": "preparedRaster",
  "threshold": 127,
  "width": 350
}
