{
  "fixtureID": "uni0055",
  "height": 700,
  "invert": false,
  "options": {
    "emHeight": 1088.0,
    "grid": 2,
    "smoothing": 1.0
  },
  "rasterPNG_SHA256": "63ea78eca3759b61d83f7a2cb91d4313123f297d8790e711bd34195a2d9a21fe",
  "schemaVersion": 1,
  "sourceRevision": "23073ca08ecdac61ad0e838bfae49a590bc2c7cc",
  "stage": "preparedRaster",
  "threshold": 128,
  "width": 478
}
