{
  "fixtureID": "uni0072",
  "height": 700,
  "invert": false,
  "options": {
    "emHeight": 1088.0,
    "grid": 2,
    "smoothing": 1.0
  },
  "rasterPNG_SHA256": "d9384a59bdc65c80ea748aec151a0fecb26018a0a42a19f1920c1d4d93771c03",
  "schemaVersion": 1,
  "sourceRevision": "23073ca08ecdac61ad0e838bfae49a590bc2c7cc",
  "stage": "preparedRaster",
  "threshold": 128,
  "width": 226
}
