{
  "fixtureID": "uni0030",
  "height": 700,
  "invert": false,
  "options": {
    "emHeight": 1088.0,
    "grid": 2,
    "smoothing": 1.0
  },
  "rasterPNG_SHA256": "bf0fbcafe6cfdf413caaa361a9d5d0dbbfbf160ba92182a8dfc2c2dd56f4625f",
  "schemaVersion": 1,
  "sourceRevision": "23073ca08ecdac61ad0e838bfae49a590bc2c7cc",
  "stage": "preparedRaster",
  "threshold": 127,
  "width": 427
}
