{
  "fixtureID": "uni0065",
  "height": 700,
  "invert": false,
  "options": {
    "emHeight": 1088.0,
    "grid": 2,
    "smoothing": 1.0
  },
  "rasterPNG_SHA256": "eea261f75b06a45af56c986b4fdb7c3c60f900b214c6f423aee49c3ba65d62d4",
  "schemaVersion": 1,
  "sourceRevision": "23073ca08ecdac61ad0e838bfae49a590bc2c7cc",
  "stage": "preparedRaster",
  "threshold": 128,
  "width": 388
}
